points,current_index,room_code,question_text,choice1,choice2,choice3,correct_choice
0,1,ADFASS,Who won the FIFA World Cup in 2018?,France,Brazil,Germany,choice1
0,2,ADFASS,Which player has the most goals in the history of the UEFA Champions League?,Cristiano Ronaldo,Lionel Messi,Raul,choice1
0,3,ADFASS,In which country is the football club Barcelona located?,Spain,Italy,Germany,choice1
0,4,ADFASS,Who is known as the "Special One" in football?,Jose Mourinho,Carlo Ancelotti,Arsene Wenger,choice1
0,5,ADFASS,Who won the Ballon d'Or in 2021?,Lionel Messi,Cristiano Ronaldo,Robert Lewandowski,choice1